name,location,bio,websiteUrl,logoUrl,categories,values
TRYMODEST,US,"TRYMODEST offers stylish, high-quality modest fashion from around the world, created to empower women to express their beauty without compromising their values. With a diverse team from Turkey, South Asia, East Asia, and the Middle East, the brand understands cultural preferences and is committed to excellent customer service, safe delivery, and affordability. Their mission is to make modest fashion accessible to everyone, helping women feel confident and beautiful regardless of budget or background.",https://trymodest.com/,https://trymodest.com/cdn/shop/files/Logo_Try_Modest_Limited.webp,dresses;handbags;hoodies;jackers;jumpsuits;playsuits;skirts;pants;scarves;shirts;tops,
MAISON CHADDEN,France,"Chadden is a haute couture house specializing in modest, bespoke event dresses, particularly for weddings. Their team, led by the manager and fashion designer, works closely with stylists and dressmakers to create unique, personalized pieces. The brand emphasizes creativity, passion, and dedication, turning dreams into magical, tailor-made designs.",https://www.maisonchadden.com/,https://static.parastorage.com/client/pfavico.ico,dresses,bridal;tailor-made
AL HAYAJAB,UK,"AL HAYAJAB is a modest fashion brand focused on creating timeless, elegant pieces that help women feel confident and empowered. Their luxury items emphasize class, quality, and style for any occasion. The brand prioritizes customer satisfaction and loyalty, aiming to build a strong community of confident, well-dressed women.",https://alhayajab.com/,https://alhayajab.com/cdn/shop/files/IMG_6398_2.jpg,dresses;hair accessories,hand-made;luxury
LYRA MODEST,UK,"LYRA is a modest swimwear brand created to offer stylish, functional pieces for women who want coverage without compromising on design or performance. Launched in 2016, their range features premium Italian fabrics, UV protection, and versatile sets including leggings, long-sleeve tops, and turban-style head coverings. Inspired by global aesthetics and modern elegance, it caters to women of all backgrounds who value comfort, confidence, and style in active and beachwear.",https://lyramodest.com/?,https://lyramodest.com/cdn/shop/files/FAVICON_4b506fcb-2312-4b38-a870-198c5d1e8a85.png?v=1750478432&width=96,swimwear;activewear,swimwear
MERRACHI,Belgium,"MERRACHI is a contemporary modest fashion brand founded in 2020 by Nada Merrachi, inspired by her own journey of covering her hair while maintaining personal style. The brand offers stylish, comfortable abayas and shawls that empower women to express confidence and individuality without compromising on modesty. It celebrates unity, inclusivity, and self-expression, creating designs that are both functional and fashion-forward for women often overlooked by the mainstream fashion industry.",https://bymerrachi.com/,https://bymerrachi.com/cdn/shop/t/99/assets/favicon-32x32.png,scarves;hair accessories;handbags,
HANNA MODESTY,Germany,"HANAA is a modest fashion brand founded in 2024 by Ibtissam, who has worn the hijab since age 12 and developed a passion for style and trends. Inspired by the positive response to her social media outfit posts, she launched her online shop to share joy and elegance through her collections. It aims to combine modesty with style, helping women feel beautiful, confident, and happy in their fashion choices.",https://hanaa-modesty.de/,https://hanaa-modesty.de/cdn/shop/files/favicon_hanaa.png,dresses;tops;skirts;pants,
SAKEENAH CO,Nigeria,"SAKEENAH CO is a modest‑fashion, made-to-order brand promising timeless styles and size inclusivity.",https://shopsakeenah.co/,https://shopsakeenah.co/favicon.png,tops;dresses;pants,
THE WOMEN ZONE,Pakistan,"THE WOMEN ZONE, founded in 2015, is a premium Pakistani hijab brand offering high-quality, handpicked fabrics and designs. They provide modern, stylish hijabs that combine fashion with modesty, aiming to make Muslim women feel confident, comfortable, and on-trend. The brand focuses on delivering a chic, contemporary twist to traditional hijabs.",https://thewomenzone.pk/,https://thewomenzone.pk/cdn/shop/files/shopify_Favicon.png,dresses;scarves;hair accessories,
BENDING THE TREND,Australia,"BENDING THE TREND, founded in 2018 by Fadwa Assaad, is a modest fashion brand created to empower women through modern, stylish designs. The brand focuses on offering versatile pieces for every occasion, eliminating the need for layering. Its mission is to blend modesty with contemporary fashion in a seamless, empowering way.",https://bendingthetrend.com.au/,https://bendingthetrend.com.au/cdn/shop/files/logo-01.jpg,dresses;tops;skirts;pants,